<?xml version="1.0" ?>
<bsyslib xmlns="http://www.bricsys.com/bsyslib" xmlns:xsi="http://www.w3.org/2001/XMLSchema-instance" xsi:schemaLocation="http://www.bricsys.com/public/bsyslib_profiles.xsd">
    <!--
    This sample is equivalent to sample_profiles.xml but can be validated
    against bsyslib_profiles.xsd.
    -->

    <profilestandard id="100">ProfileStandard1</profilestandard>

    <profilename id="1">
        <standard id="100"/>
        <name>ProfileName1</name>
        <type>StructuralSteel</type>
    </profilename>

    <profilename id="2">
        <standard id="100"/>
        <name>ProfileName2</name>
    </profilename>

    <profilename id="3">
        <name>ProfileName3</name>
    </profilename>

    <profilename id="4">
        <name>ProfileName4</name>
        <type>Piping</type>
    </profilename>
    
    <circleprofile>
        <name id="1"/>
        <size>50</size>
        <radius>50</radius>
    </circleprofile>

    <circleprofile>
        <name id="4"/>
        <size>40</size>
        <radius>40</radius>
    </circleprofile>
</bsyslib>
